{"O_counted":["0000000000000000000000000000000000000000000000000000000000000017"],"R_counted":["0000000000000000000000000000000000000000000000000000000000000027"],"authority_digest":"0000000000000000000000000000000000000000000000000000000000000010","capacity_digest":"0000000000000000000000000000000000000000000000000000000000000064","capacity_phase":"RETENTION_ACCOUNTED","content_digest":"0000000000000000000000000000000000000000000000000000000000000065","descriptor_digest":"0000000000000000000000000000000000000000000000000000000000000066","envelope_digest":"0000000000000000000000000000000000000000000000000000000000000024","generation":3,"global_bytes":512,"global_files":4,"intent":{"authority_digest":"0000000000000000000000000000000000000000000000000000000000000010","expected_generation":3,"intent_digest":"0000000000000000000000000000000000000000000000000000000000000020","nonce":"0000000000000000000000000000000000000000000000000000000000000021","output_digest":"0000000000000000000000000000000000000000000000000000000000000017","profile_digest":"0000000000000000000000000000000000000000000000000000000000000031","release_schema_digest":"0000000000000000000000000000000000000000000000000000000000000032","reservation_id":"reservation-1","stable_slot_digest":"0000000000000000000000000000000000000000000000000000000000000033","target_roles":["D","M","R","P","H"]},"intent_digest":"0000000000000000000000000000000000000000000000000000000000000020","kind":"accounted","output_digest":"0000000000000000000000000000000000000000000000000000000000000017","p_max_bytes":1024,"p_max_files":8,"p_path":"retention/slot-1/p-accounted","per_slot_bytes":512,"per_slot_files":4,"profile_digest":"0000000000000000000000000000000000000000000000000000000000000031","proof_nonce":"0000000000000000000000000000000000000000000000000000000000000028","prospective_bytes":768,"prospective_files":5,"ready_journal_digest":"0000000000000000000000000000000000000000000000000000000000000067","ready_journal_generation":2,"release_id":"release-0.2.1","release_schema_digest":"0000000000000000000000000000000000000000000000000000000000000032","reservation_id":"reservation-1","schema":"kilix.content.retention/v1","stable_slot_digest":"0000000000000000000000000000000000000000000000000000000000000033","state_digest":"0000000000000000000000000000000000000000000000000000000000000068","transaction_phase":"RETENTION_ACCOUNTED","version":1}
